maker_id,maker_name,role,date,info,identical_to,frequent_city
3007,"Paquotte, Jean Baptiste",Violin maker,fl. 1841-1849,Jean Baptiste Paquotte was the nephew of Sébastien Paquotte. He apprenticed with Simon as a bow maker and later studied violin making with Sébastian in Paris from 1841 to 1849.,,
10806,"Paquotte, Placide",,1864-1900,"Placide Paquotte was the son, pupil, and successor of Jean-Baptiste Paquotte. He was a fine craftsman, excelling as both a maker and a restorer.",,
1897,"Paralupi, Rudolfo",Violin maker,1890,Rudolfo Paralupi was active as a guitar maker in Rome from 1922 and made his first violin in 1927. He received awards in Rome in 1929 and in Parma in 1933.,,
15586,"Pareschi, Gabriele",Violin maker,,,,Piacenza
517,"Pareschi, Gaetano",Violin maker,1900-1987,Gaetano Pareschi created classical Cremonese and personal models. He used golden- or red-brown varnish.,,Ferrara
3008,"Parizot, Rémy",Violin maker,fl. 1774,"Rémy Parizot was active in Nantes from 1774. His workmanship was ordinary, but the arching and varnish were good.",,
1040,"Parker, Daniel",Violin maker,c. 1700,"One of the most accomplished and mysterious British violin makers, Daniel Parker seems to have been a contemporary of John Hare and may have studied with Barak Norman . He probably did much of his work for those two makers, in addition to other London shops, but there is no evidence that he served a formal apprenticeship or ever ... set up on his own.",,London
1289,"Parkinson, James",–,,,,
10830,"Parkinson, John",Violin maker,c. 1849,"John Parkinson was a coal miner and amateur luthier. He worked in collaboration with his brother-in-law, Fisher.",,
15643,"Parlato, Luca Maria",Violin maker,,,,Cremona
2727,"Parmeggiani, Romolo",Violin maker,1888-1964,"Romolo Parmeggiani was a violinist and a maker of violins and bows, known for his Stradivari model. He received awards in Fiume and Cremona in 1937, as well as in Rome in 1952 and 1954, and also in New York.",,Modena
10837,"Paroche, Léon",,1920,Léon Paroche was the name given in commercial Mirecourt instruments sold in London by Beare & Son. Modèle / Billancourt / B&SL Anno..,,
518,"Parravicini, Piero",Violin maker,1889-1957,Piero Parravicini worked as a pupil of R. Antoniazzi.,,Milan
10849,"Partl, Christian Franz",Violin maker,c. 1737-1807,Christian Franz Partl worked with coarse materials and dull brown varnish. Some instruments were unpurfled and lacked linings or blocks.,,
3009,"Partl, Ignaz Christian",Violin maker,1732-1819,Ignaz Christian Partl was the son of Michael Andreas Partl. He created a neatly made Stainer model featuring a high arch with small edges and corners.,,
1130,"Passa, Frank",Bow maker,,Frank Passa was a violin and bow maker and a pupil of S. F.,,San Francisco
2404,"Pasta, Domenico",Violin maker,c. 1690,"Domenico Pasta was the son of Bartolomeo Pasta and worked alongside his brother Gaetano in the workshop called 'Alla Pallada'. The models were inspired by Amati and Maggini, showcasing convincing workmanship.",,Brescia
2405,"Pasta, Gaetano",Violin maker,c. 1679,"Gaetano Pasta was the son of Bartolomeo Pasta and was active in Brescia from around 1694. His work featured exuberant classical forms along the lines of Amati and Rogeri, characterized by impetuous craftsmanship.",,Brescia
1545,"Patigny, Pierre",Bow maker,,Brussels-based bow maker. Period bow copies.,,
10872,"Patocka, Benjamin",Bow maker,1864-1931,Benjamin Patocka was a violin and bow maker. He was a pupil of Josef Metelka in Paseky in 1879.,,
10876,"Patten, W. H.",,c. 1908-1909,,,
862,"Paul, Adam D.",–,,,,
10889,"Pauli, Jan Bohuslav (Johannes Godefridus)",,1707-1771,Jan Bohuslav (Johannes Godefridus) Pauli was the son of Antonín Pauli. His work was unremarkable and featured a transparent yellow varnish.,,
519,"Pauli, Joseph",Violin maker,1770-1846,Joseph Pauli was a pupil of J. G.,,Linz
10892,"Paulsen, Carl A.",,b. 1879,Carl A. Paulsen was the son and pupil of P.,,
1541,"Paulsen, Peter Christian",Violin maker,1850-1920,Peter Christian Paulsen emigrated to the USA in 1882. He was a pupil of P.,,Aachen
10900,"Paulus, Albin Ludwig",Violin maker,1866-1946,Albin Ludwig Paulus was a pupil of Dolling. He established himself independently around 1890 and was assisted by his son Kurt.,,
974,"Paulus, Bruno Franz",–,,,,
1212,"Paulus, Günter A.",Bow maker,,,,
10909,"Paulus, Johann Georg",Bow maker,c. 1752-1821,Johann Georg Paulus was a luthier to the Pmssian Court. His work was fine but lacked distinction in any way.,,
1336,"Paulus, Johannes O.",Bow maker,1916,,,Markneukirchen
10913,"Paulus, Konrad Friedrich",,b. 1879,Konrad Friedrich Paulus was a pupil of his brother Albin Ludwig Paulus . He worked for J.,,
10918,"Paulus, Otto Paul",,b. 1881,Otto Paul Paulus studied under his brother Albin Paulus. He worked for Tieteman in Wolfenbütttel and established himself independently in Markneukirchen starting in 1904.,,
520,"Pawlikovsky, Jan",Violin maker,,,,
860,"Payne, A.R.",–,,,,
2406,"Pazarini, Antonio",Violin maker,c. 1700-1744,"Antonio Pazarini was a very rare Genoese maker of the 18th century who worked in association with Bernardo Calcani. Surviving instruments suggest that they produced instruments together, often labeled 'Antonius Pazarinius et Calcanius / Genuae 1740.' Pazarini's models were large, featured a medium high arching, and had an orange varnish",,
10933,"Pearce, George",,1820-1856,...,,
10937,"Pearce, William",,c. 1838,William Pearce was the brother or father of George. He was an employee of Forster.,,
523,"Peccatte, Charles",Bow maker,1850-1918,"Son of François Peccatte and nephew of Dominique , Charles Peccatte was born into a family of great bow making pedigree. Following his father's death in 1851, he began his apprenticeship in 1862 to his stepfather Auguste ...",,Paris
522,"Peccatte, Dominique",Bow maker,1810-1874,Dominique Peccatte was born in Mirecourt and at first was apprenticed to a hairdresser. On the recommendation of Nicolas Vuillaume he moved to Paris in 1826 to join J.B.,,Paris
521,"Peccatte, Dominique & François",Bow maker,,,,
1120,"Peccatte, François",Bow maker,1821-1855,"Younger brother of Dominique Peccatte , François Peccatte began his apprenticeship near Mirecourt but left to join his brother in Paris sometime around 1840. Dominique was a formative influence on his brother's work, which features square, strong heads and is of good quality.",,Mirecourt
2704,"Pecchini, Vasco",Violin maker,1893-1975,Vasco Pecchini was a violin and bow maker. He studied under E.,,
15530,"Pedani, Tommaso",Violin maker,,,,Florence
10949,"Pedicino, Costanzo",Violin maker,1935-2002,Costanzo Pedicino was an artist and a self-taught luthier. He created both Stradivari and personal models.,,
524,"Pedrazzini, Giuseppe",Violin maker,1879-1957,"The son of a carpenter, Pedrazzini was born in the village of Pizzeghettone near Cremona. In 1903 he moved to Milan where he appears to have taught himself violin making, with some advice from Romeo Antoniazzi .",,Milan
525,"Pedrinelli, Antonio",Violin maker,1781-1854,"Antonio Pedrinelli was a prolific maker known for models and copies of many classical Italian makers. His work was produced in various grades, featuring different levels of finish and materials.",,Crespano
527,"Pelizon, Antonio I",Violin maker,1763-1850,"Antonio Pelizon was presumably the son of Francesco Pelizon. His work was impetuous and not dissimilar to Landoll Arching, being of medium height but rather box-like.",,Gorizia
526,"Pelizon, Giuseppe Francesco",Bow maker / Violin maker,1800-1874,Giuseppe Francesco Pelizon worked with the bow maker V. Schilling.,,Gorizia
528,"Pellacani, Giuseppe",Violin maker,1900-1995,Giuseppe Pellacani was a violinist and a pupil in lutherie of N. Bianchi in Nice and E.,,Modena
10966,"Pellerani, Antonio",Violin maker,c. 1871,,,
2572,"Peluzzi, Giuseppe",Violin maker,1856-1939,Giuseppe Peluzzi was active for some time in Turin. He produced very fine and clever work on Cappa and Rocca models.,,
10978,Penzel Family,Bow maker / Violin maker,,"Penzel was part of a family of luthiers and bow makers who worked in Vogtland, Germany, and Bohemia, Czech Republic.",,
529,"Penzel, Emil Max",Bow maker,1887-1953,,,
1192,"Penzel, Gerhard Kurt",Bow maker,b. 1929,,,
10979,"Penzel, Gustav",,c. 1882-1914,Gustav Penzel was a bow maker of some distinction. He used good pernambuco wood and branded both octagonal and round sticks with the mark: PENZEL.,,
10983,"Penzel, P. Robert",Violin maker,b. 1873,P. Robert Penzel was a pupil of O.,,
530,"Penzel, Richard",Bow maker,c. 1925,,,
1256,"Penzl, Ignaz",–,,Ignaz Penzl was presumably connected to the Penzel family. He engaged in commercial work on an Amati/Stainer-derived model.,,
11470,"Pérain, François",,c. 1780-1800,François Pérain used hard orange-red varnish and fine materials. It was branded on the back: 'françois perain'.,,
531,"Peresson, Sergio",Violin maker,1913-1991,"Sergio Peresson was active from 1943. He moved to Caracas, Venezuela in 1947 and was employed as a repairer for the Venezuelan Symphony Orchestra.",,"Haddonfield, NJ"
2176,"Perrard, Eugene",Violin maker,b. 1895,Eugène Perrard apprenticed to L. Mougenot.,,Paris
1094,"Perrin, Étienne",Violin maker,fl. 1876-1918,Étienne Perrin created typical Mirecourt work featuring a flat arch and thin spirit varnish. It was branded: `E.,,Mirecourt
11020,"Perrin, François",Violin maker,b. 1755,François Perrin created typical commercial work of the time and place. It featured low arching with a decent golden-orange or brown varnish.,,
1048,"Perry, David P.",–,,,,
1290,"Perry, James",–,,"James Perry was the younger brother of Thomas Perry (II). He produced coarse work, some of which was unpurfled.",,
1409,"Perry, L.A.",–,,,,
532,"Perry, Stephen",Violin maker,,Stephen Perry created models based on Guarneri and Brescian designs. Approximately 12 were made using local materials.,,"Lowell, MA"
11024,"Perry, Thomas I",Violin maker,d. 1771,"Thomas Perry was thought to have been a descendant of Claude Pierray of Paris. He established himself in Christ Church Yard from 1741 and was recorded as 'Mr Pierrie, Fiddle Maker' at the time of his death.",,
1616,"Perry, Thomas II",Violin maker,1744-1818,"Thomas Perry was an Irishman by birth, but is thought to have been related to the French violin maker Claude Pierray . He followed in the footsteps of his father, also a violin maker, and took over his shop in Dublin around 1766.",,Dublin
1538,Perry & Wilkinson Firm,Violin maker,,,,
533,"Persoit, Jean Pierre Marie",Bow maker,c. 1783,"A general examination of his style suggests the influence of Nicolas Lupot , but it is not known for certain where Jean Pierre Marie Persoit learned bow making or who initially employed him. Around 1825 he began to mark some of his bows with a characteristic ""P.R.S.,"" which explains why his name was misspelled as ""Persois"" for ... so long.",,Paris
1254,"Peternella, Jago",Violin maker,1886-1970,"Jago Peternella, originally from Legnano near Verona, emigrated to the USA in 1934. He is known for his fine craftsmanship and materials, reflecting the style of Giulio Degani, with whom he is thought to have trained in Venice.",,"San Diego, CA"
3141,"Peters, William L.",Violin maker,c. 1903,William L. Peters created classical Italian models featuring distinctive edge work.,,"Hartford, CT"
11042,"Peterson, P. A.",,c. 1875-1907,,,
11044,"Petesh, Zenon Wladimir",Violin maker,1906-1992,"Zenon Wladimir Petesh made six violins around 1935. He was a pupil of Didtchenko in Warsaw, Poland from 1937 to 1940.",,"Chicago, IL"
15727,"Petitcolas, Jean",Violin maker,1924-2021,,,
2482,"Petraglia, Emilio",Violin maker,fl. 1937,Emilio Petraglia was a pupil in Buenos Aires of Giovanni Capalbo . He was appointed luthier to the Argentine government in 1937.,,
3014,"Petz, Jakob I",Violin maker,1742-1824,Jakob Petz was the nephew of Franz Petz and created fine work on typical Tyrolean models. The long form featured arching of medium height.,,
11076,"Petz, Marianus",,1742-1787,Marianus Petz was the successor to J. F.,,Vienna
11081,"Petzold, Franz Paul",,1865,Franz Paul Petzold worked in Gablenz in 1885 and established himself in Chemnitz from 1888. He produced good professional work with spirit varnish.,,
11082,"Petzold, Hermann",,1880-1945,"Hermann Petzold was the son and pupil of Ernst Hermann Petzold . He worked in Nuremberg, Magdeburg, and Gera in 1931, and in Berlin from 1934.",,
534,"Pevere, Ernesto",Violin maker,1891-1963,Ernesto Pevere was a pupil of E. Soffriti.,,Ferrara
11087,"Peyrot, Alfred",,b. 1904,Alfred Peyrot was a professional cellist and a self-taught amateur maker and repairer. He may have been influenced by J.,,
11089,"Pezzoni, William V.",Violin maker,c. 1895,William V. Pezzoni worked in the violin department at the C.,,
11090,"Pfab, Friedrich August",,1822-1904,Friedrich August Pfab apprenticed in Klingenthal. He worked in Hamburg starting in 1844 and received several medals.,,
535,"Pfeil, Paul",Violin maker,,,,"Hoboken, NJ"
11103,"Pfretzschner, Berthold Walter",,1856-1921,"Berthold Walter Pfretzschner was a bow maker. He was the son, pupil, and assistant of Hermann Pfretzschner.",,
536,"Pfretzschner, Carl Friedrich I",Violin maker,1743-1798,Carl Friedrich Pfretzschner was admitted to the guild of violin makers in 1765. He was a distinguished maker of the Saxon school and a prolific craftsman.,,Markneukirchen
11106,"Pfretzschner, Carl Friedrich II",,1845,Carl Friedrich Pfretzschner worked for Bausch in Leipzig in 1863. He established himself in Markneukirchen from 1871 to 1886.,,
11108,"Pfretzschner, Carl Gottlob",,1807-1863,Carl Gottlob Pfretzschner was the son and pupil of Christoph Gottfried Pfretzschner. He apprenticed in Dresden and worked in Hamburg before returning to Markneukirchen around 1830.,,
1061,"Pfretzschner, E.R.",–,,,,
1103,"Pfretzschner, F.C.",–,,,,
538,"Pfretzschner, G.A.",Bow maker / Violin maker,,,,Markneukirchen
854,"Pfretzschner, Hermann Richard",Bow maker,1857-1921,"Without question one of the most important figures in the history of German bow making, Hermann Richard Pfretzschner initially studied with his father Carl Richard before working for one year in the shop of J.B. Vuillaume in Paris, in 1874.",,Paris
11121,"Pfretzschner, Johann Gottfried",Violin maker,c. 1730,Johann Gottfried Pfretzschner was the son of Johann Elias Pfretzschner (I). He was admitted to the Markneukirchen guild of luthiers in 1751.,,
537,"Pfretzschner, Johann Gottlob",Violin maker,1753-1823,Johann Gottlob Pfretzschner created instruments with good workmanship on an elongated Stainer model. The high arch featured a characteristically Saxon head with an exaggerated tail behind the eye of the volute.,,Markneukirchen
1408,"Pfretzschner, Leopold",–,,,,
11114,"Pfretzschner, Richard Hermann",,1876-1958,Richard Hermann Pfretzschner was a bow maker. He was the son and pupil of Hermann Richard Pfretzschner.,,
1624,"Pfretzschner, Wilhelm August",Bow maker,1871-1939,,,Markneukirchen
16074,"Philibert, Jean-Michel",Bow maker,,,,
11138,"Phillips, Benjamin F.",Violin maker,1886-1977,...,,"Pittsburgh, PA"
11143,"Phillipson, Edward",Bow maker / Violin maker,b. 1859,"Edward Phillipson served as an Evangelical Minister at Aspatria from 1890 to 1925. He was a self-taught maker of violins and bows, utilizing Stradivari models.",,
1926,"Phipps, Dr. J. M.",Violin maker,fl. 1894,"Worked c. 1894. Label is branded to the back, with the date handwritten.",,"Evansville, IL"
2071,"Phipps, William",Violin maker,,,,Franklin
539,"Piastri, Bruno",Violin maker,,,,Gabicce
1947,"Piattellini, Gasparo",Violin maker,1763-1840,"Gasparo Piattellini was the father or brother of Luigi Piatellini (I). He created fine work based on the Gabrielli/Amati model, featuring a medium arch and excellent red-brown varnish.",,
2512,"Piattellini, Luigi I",Violin maker,c. 1750,Luigi Piattellini was a pupil of G. B.,,Florence
540,"Piccagliani, Armando",Violin maker,1879-1945,"Armando Piccagliani produced 600 instruments in total, including violins, violas, cellos, and double basses. He exhibited a viola and cello at Cremona in 1937 and received awards at Genoa in 1922 and at Rome.",,Modena
15406,"Piccinotti, Marco",–,,,,
541,"Pickard, Handel (Andrew)",Violin maker,1856-1875,"Handel (Andrew) Pickard established a music shop at 127 Kirk Gate, Leeds, using the name 'Handel' for business purposes. He was likely a pupil or assistant of Dearlove.",,Leeds
11162,"Pickering, John G.",Violin maker,c. 1832,,,
1228,"Pickstone, Harry",–,,,,Birmingham
11167,"Piegendorfer, Georg",,1849-1906,"Active since 1880, he was awarded first prize at the Augsburg Exhibition in 1886. He was succeeded in business by O.",,
543,"Piernot, Marie Louis",Bow maker,1880-1959,Marie Louis Piernot was a bow maker. He studied under C.,,Paris
1025,"Pierray, Claude",Violin maker,1700-1740,"Claude Pierray established himself in the rue des Fossés, Saint-Germain-des-Prés from 1725, further identified as `proche la Comédie Français'. He was the most influential maker of the 'vie= Paris' school, working with a form very similar to that of Amati.",,Paris
11180,"Pierre, Jean Etienne",,d. 1784,Jean Etienne Pierre created a highly arched original model that featured brown varnish. It was rarely encountered.,,
15397,"Pierre, Théophile",Violin maker,,,,
11191,"Pilar, Antonín I",,1881-1958,"Antonín Pilar apprenticed to Benjamin Patocka in Jicin. He worked for Cermak in Kutna Hora (Kuttenberg) in 1899 and for Stowasser in Graz in 1900, then spent eight years in Berlin working with Möckel.",,Berlin
11194,"Pilar, Karel",,b. 1899,"Apprenticed to his uncle Antonín Pilar (I), in Berlin. Worked for O.",,
15344,"Pilar, Vladimir",Violin maker,1926-2008,,,Hradec Králové
11195,"Pilát, Paul (Pál) I",Violin maker,1860-1931,Paul (Pál) Pilát studied under T. Zach in Vienna from 1872 to 1877.,,Budapest
544,"Pilat, Paul Ernst (Pál Ernö)",Violin maker,1897-1961,"Paul Ernst (Pál Ernö) Pilat was the son and pupil of Paul Pilat (I). He emigrated to the USA in 1921, initially working for Frederick Markert in New York before establishing his own workshop in 1932.",,"New York, NY"
1121,"Pillement, François",Violin maker,,"François Pillement was known as 'Tillement père', as some authorities believed that 'Jean François Pillement' was his son, although this appears not to be accurate; 'Jean' and 'Jean François' referred to the same person. He produced many fine violins, cellos, and double basses, which were branded and labelled variously as 'Mirecourt', 'Paris', and 'Cremona', yet all were made in Mirecourt.",,Mirecourt
855,"Pillot, J",–,,,,
11202,"Pillyser, Alphonse",,c. 1942,Alphonse Pillyser created Stradivari and Guarneri copies. His work featured fine craftsmanship with rich red varnish.,,
1585,"Pilsel, Rudolf",–,,,,
11208,"Pineau, Joseph",,1881,Joseph Pineau was a pupil of A. Tolbecque starting in 1896.,,
1833,"Piñeiro, Horacio",–,,Born in Buenos Aires Piñeiro began working on string instruments at the age of fourteen under Franco Ponzo. He later worked for Henry Viret in Argentina and Pierre Gaggini in Nice.,,Buenos Aires
546,"Pinel, J.",Violin maker,1865-1885,J. Pinel produced work characterized by narrow edges and a transparent varnish in shades of orange-brown or red.,,Chaumont
16092,"Pinget, Lionel",Violin maker,,,,
11214,"Pinney, Harold A.",,b. 1894,Harold A. Pinney was a pupil of George Granger.,,
15402,"Pioros, Louis",Violin maker,,,,
1650,"Piper, William",–,,,,
1122,"Pique, François-Louis",Violin maker,1758-1822,"A contemporary and friend of Nicolas Lupot , François Pique was born in Roissy Ile de France, near Paris. It is unclear where he learned violin making, but by 1787 he had moved to Paris and set up his own workshop.",,Paris
1414,"Pique, Leon",–,,,,
11223,"Pirani, Vittorio",,c. 1952,,,Florence
11225,"Pires, Ivo",,1942-2009,Ivo Pires was active in the USA from 1967. He was employed as a repairer by the Carl Fischer Co. in Boston.,,
1084,"Piretti, Enrico",,b. 1911,Enrico Piretti was a maker of various types of bowed and plucked instruments. His workmanship was noted for its quality.,,Bologna
547,"Pirot, Claude",Violin maker,1792-1835,"Claude Pirot established his workshop in the rue des Grands Augustins. He created fine Stradivari models, some featuring slightly raised arches; the best examples were comparable to those of Lupot.",,Paris
15490,"Pistoni, Primo",Violin maker,,,,Cremona
548,"Pistucci, Giovanni",Violin maker,1864-1955,Giovanni Pistucci was a pupil of V. Postiglione and was active from 1885.,,Naples
549,"Pizzamiglio, Carlo",Violin maker,b. 1914,Carlo Pizzamiglio trained as a cabinetmaker. He was a self-taught violin maker starting in 1932.,,Sesto Cremonese
11250,"Pizzolini, Mario",Bow maker,b. 1922,Mario Pizzolini was a pupil of G. Peluzzi.,,
11267,"Placht, Johann Franz",,c. 1772-1799,"Johann Franz Placht was the son and pupil of Franz Placht (I). He created similar work featuring flat arches, one-piece backs, and deep orange varnish.",,
1630,"Plain, Walter",,d. 1879,"Walter Plain apprenticed as a cabinet maker in Edinburgh. He possibly trained under his neighbor in Brunswick Street, Robert Ballantyne , whose work resembled his own.",,
2418,"Platner, Alberto",Violin maker,c. 1680,"Alberto Platner was presumed to have been of Tyrolean origin. He was first recorded with the Dominicus family in Rome, who were makers of plucked instruments.",,Rome
551,"Platner, Michele",Violin maker,1684-1752,"Initially thought to have been a student of fellow Roman David Tecchler Domenico Michele Platner apprenticed with his father in Rome in the early 18th century before taking over the family workshop. Little is known about his working life, but he is known to have trained his nephew Giulio ...",,Rome
552,"Pliverics, Emil",Violin maker,1878-1964,Emil Pliverics worked as a pupil of A. Setzer in Budapest.,,Berlin
15968,"Plog, Nico",Bow maker,,,,
1050,"Plowright, Dennis",–,,,,
1013,"Plumerel, Charles",Violin maker,1822-1864,Charles Plumerel worked for Daniel in Marseilles. The relationship to Charles Plumerel (II) below remained unclear.,,
11294,"Plumerel, Jean",Violin maker,c. 1727-1752,"Jean Plumerel worked in Mirecourt, producing ordinary instruments with a plain yellow varnish. Violins and cellos are extant.",,
15700,"Pochekin, Yuri",Violin maker,,,,Madrid
553,"Podesva, Jan",Violin maker,,Jan Podesva was a houslar in Brno in the year 19.. He worked with Stradivari and Guarneri models.,,Brno
11296,"Podgorny, Timofey Filippovich",Violin maker,1873-1958,Timofey Filippovich Podgorny was a self-taught maker and repairer. He established himself professionally in Krasnodar (formerly Yekaterinodar) from 1900.,,
11297,"Podlaha, Frantisek",,b. 1894,Frantisek Podlaha created models based on Stradivari and Guarneri. He worked in Prague in the year 19..,,
1550,Poehland & Fuchs Firm,–,,,,
554,"Poggi, Ansaldo",Violin maker,1893-1984,"Probably the most renowned of Giuseppe Fiorini's students, Ansaldo Poggi owed his introduction to his teacher to the friendship between Fiorini and Poggi's father, an amateur violin maker. After learning the basics at home, Poggi moved to Zurich to train with Fiorini and then returned to Bologna several years later. ... />The impact of Fiorini's style is especially evident in Poggi's first independent work.",,Bologna
2135,"Poirson, Dominique ""Justin""",Bow maker,1851-1925,Dominique Poirson was a bow maker who trained in Paris with Nicolas Maire starting in 1865. He worked for J.,,Paris
555,"Poirson, Elophe",Violin maker,fl. 1876-1918,"Elophe Poirson completed around 300 instruments (violins, violas, and cellos) between 1876 and 1918. His work was of good quality and featured his own varnish.",,Lyon
16055,"Poirson, Leon",Violin maker,,,,
11311,"Poirson, Louis",,c. 1912,Louis Poirson modeled his work after Stradivarius. The work and varnish were of decent quality.,,
557,"Poletto, Giovanni Battista",Violin maker,,,,Monza
559,"Politi, Enrico",Violin maker,1885-1979,"Enrico Politi was the son, pupil, and assistant of Eugenio Politi in Rome. After his father's death in 1909, he worked with his brother Fernando before relocating to Turin.",,Rome
2747,"Politi, Eugenio",Violin maker,1853-1909,Eugenio Politi was a pupil of E. Ceruti.,,
558,"Politi, Raul",Violin maker,b. 1913,Raul Politi was the son and pupil of Enrico Politi and also trained as a violinist. He created over 150 instruments based on the Stradivari model.,,
11323,"Pollard, Edwin",Violin maker,1845,"Edwin Pollard was active in Blackpool from 1862. He generally used the Stradivari model, although he made 12 violins on Stainer forms between 1910 and 1912.",,
560,"Pollastri, Augusto",Violin maker,1877-1927,"One of the finest twentieth century Italian violin makers, Augusto Pollastri first worked as a messenger boy for Raffaele Fiorini and became a full-fledged apprentice around 1894. He quickly became one of the most skilled makers in the Fiorini workshop, and opened his own shop in the late 1890s.",,Bologna
561,"Pollastri, Gaetano",Violin maker,1886-1960,"Bolognese violin maker Gaetano Pollastri followed the models developed by his brother Augusto , with whom he worked from a young age. After Augusto died in 1927, Gaetano opened his workshop and began to sign his own instruments, inheriting a significant portion of his late brother's customers.",,Bologna
921,"Poller, Anton II",Violin maker,c. 1925,"Anton Poller studied under J. Ringer in Luby and later worked in Markneukirchen, Mittenwald, Berlin, and other locations.",,Vienna
2140,"Poller, Michael I",Violin maker,1741-1803,Michael Poller worked in the Klotz manner. The workmanship was generally over-sized with a medium arch.,,Mittenwald
